-- mini_ivm regression test
SET client_min_messages TO warning;
SET dynamic_library_path TO '/tmp';
CREATE OR REPLACE FUNCTION mini_ivm_maintain()
RETURNS trigger
AS '/tmp/mini_ivm', 'mini_ivm_maintain'
LANGUAGE C;
CREATE OR REPLACE FUNCTION create_incremental_mv(mv_name text)
RETURNS void
AS '/tmp/mini_ivm', 'create_incremental_mv'
LANGUAGE C;
CREATE OR REPLACE FUNCTION drop_incremental_mv(mv_name text)
RETURNS void
AS '/tmp/mini_ivm', 'drop_incremental_mv'
LANGUAGE C;
-- Create base table
CREATE TABLE orders (
    product TEXT,
    category TEXT,
    amount NUMERIC
);
-- Create materialized view with all 4 aggregate types
CREATE MATERIALIZED VIEW order_summary AS
SELECT product, category,
       SUM(amount) AS total_amount,
       COUNT(*) AS num_orders,
       MIN(amount) AS min_amount,
       MAX(amount) AS max_amount
FROM orders
GROUP BY product, category;
-- Create the incremental materialized view
SELECT create_incremental_mv('order_summary');
 create_incremental_mv 
-----------------------
 
(1 row)

-- Check initial state (empty)
SELECT * FROM imv_order_summary ORDER BY product, category;
 product | category | total_amount | num_orders | min_amount | max_amount 
---------+----------+--------------+------------+------------+------------
(0 rows)

-- Test INSERT
INSERT INTO orders VALUES ('Laptop', 'Electronics', 1000);
INSERT INTO orders VALUES ('Laptop', 'Electronics', 1200);
INSERT INTO orders VALUES ('Phone', 'Electronics', 800);
SELECT 'INSERT' as test, * FROM imv_order_summary ORDER BY product, category;
  test  | product |  category   | total_amount | num_orders | min_amount | max_amount 
--------+---------+-------------+--------------+------------+------------+------------
 INSERT | Laptop  | Electronics |         2200 |          2 |       1000 |       1200
 INSERT | Phone   | Electronics |          800 |          1 |        800 |        800
(2 rows)

-- Test UPDATE non-group column (old value was the MIN, must recompute)
UPDATE orders SET amount = 1500 WHERE amount = 1000;
SELECT 'UPDATE_VAL' as test, * FROM imv_order_summary ORDER BY product, category;
    test    | product |  category   | total_amount | num_orders | min_amount | max_amount 
------------+---------+-------------+--------------+------------+------------+------------
 UPDATE_VAL | Laptop  | Electronics |         2700 |          2 |       1200 |       1500
 UPDATE_VAL | Phone   | Electronics |          800 |          1 |        800 |        800
(2 rows)

-- Test UPDATE group column (category change, DELETE+INSERT)
UPDATE orders SET category = 'Office' WHERE amount = 1200;
SELECT 'UPDATE_GROUP' as test, * FROM imv_order_summary ORDER BY product, category;
     test     | product |  category   | total_amount | num_orders | min_amount | max_amount 
--------------+---------+-------------+--------------+------------+------------+------------
 UPDATE_GROUP | Laptop  | Electronics |         1500 |          1 |       1500 |       1500
 UPDATE_GROUP | Laptop  | Office      |         1200 |          1 |       1200 |       1200
 UPDATE_GROUP | Phone   | Electronics |          800 |          1 |        800 |        800
(3 rows)

-- Test DELETE
DELETE FROM orders WHERE amount = 800;
SELECT 'DELETE' as test, * FROM imv_order_summary ORDER BY product, category;
  test  | product |  category   | total_amount | num_orders | min_amount | max_amount 
--------+---------+-------------+--------------+------------+------------+------------
 DELETE | Laptop  | Electronics |         1500 |          1 |       1500 |       1500
 DELETE | Laptop  | Office      |         1200 |          1 |       1200 |       1200
(2 rows)

-- Test multiple inserts into same group
INSERT INTO orders VALUES ('Laptop', 'Office', 100);
INSERT INTO orders VALUES ('Laptop', 'Office', 500);
INSERT INTO orders VALUES ('Laptop', 'Office', 300);
SELECT 'MULTI_INSERT' as test, * FROM imv_order_summary ORDER BY product, category;
     test     | product |  category   | total_amount | num_orders | min_amount | max_amount 
--------------+---------+-------------+--------------+------------+------------+------------
 MULTI_INSERT | Laptop  | Electronics |         1500 |          1 |       1500 |       1500
 MULTI_INSERT | Laptop  | Office      |         2100 |          4 |        100 |       1200
(2 rows)

-- Test DELETE of MIN (forces recompute)
DELETE FROM orders WHERE amount = 100;
SELECT 'DELETE_MIN' as test, * FROM imv_order_summary ORDER BY product, category;
    test    | product |  category   | total_amount | num_orders | min_amount | max_amount 
------------+---------+-------------+--------------+------------+------------+------------
 DELETE_MIN | Laptop  | Electronics |         1500 |          1 |       1500 |       1500
 DELETE_MIN | Laptop  | Office      |         2000 |          3 |        300 |       1200
(2 rows)

-- Test DELETE of MAX (forces recompute)
DELETE FROM orders WHERE amount = 1500;
SELECT 'DELETE_MAX' as test, * FROM imv_order_summary ORDER BY product, category;
    test    | product | category | total_amount | num_orders | min_amount | max_amount 
------------+---------+----------+--------------+------------+------------+------------
 DELETE_MAX | Laptop  | Office   |         2000 |          3 |        300 |       1200
(1 row)

-- Cleanup
SELECT drop_incremental_mv('order_summary');
 drop_incremental_mv 
---------------------
 
(1 row)

DROP MATERIALIZED VIEW order_summary;
DROP TABLE orders;
